{
  "registry_version": "1.0",
  "language": {
    "id": "uef-system",
    "version": "2",
    "file_extensions": [
      ".uefs"
    ],
    "entrypoint": "system"
  },
  "ownership": {
    "uetd_registry_facts": "UETD target/module/runtime/math registries",
    "project_facts": "referenced .uef node projects and system-owned contracts",
    "language_facts": "this grammar and fixed compiler semantics only"
  },
  "shared_type_contract": "../registry/registry.json#/core_types and the project type-conversion semantics: .uefs uses the same fixed-width scalars, units, arrays, nominal enums, records, and no-implicit-conversion rules; its narrower operator subset and precedence are specified in this registry, not copied from the .uef operator table.",
  "lexical": {
    "line_comments": ["#", "//"],
    "identifier": "[A-Za-z_][A-Za-z0-9_]*",
    "finite_decimal": "(?:[0-9]+(?:\\.[0-9]*)?|\\.[0-9]+)(?:[eE][+-]?[0-9]+)?",
    "hex_integer": "0[xX][0-9A-Fa-f]+",
    "integer_token": "(?:[0-9]+|0[xX][0-9A-Fa-f]+)",
    "number_token": "FINITE_DECIMAL|0[xX][0-9A-Fa-f]+",
    "token_names": {"INTEGER": "integer_token", "FINITE_NUMBER": "number_token", "IDENTIFIER": "identifier", "BOOLEAN": "true|false"},
    "string_quotes": ["\\\"", "'"],
    "string_escapes": ["\\\\", "\\\"", "\\'", "\\n", "\\r", "\\t"],
    "numeric_units_are_tokens": true,
    "signs_are_operators": true,
    "numeric_locale": "decimal_point_dot_no_grouping_separator",
    "forbidden_numeric_values": ["NaN", "Infinity", "-Infinity"]
  },
  "grammar": {
    "entrypoint": "system_file",
    "productions": {
      "system_file": "system_decl EOF",
      "system_decl": "'system' IDENTIFIER '{' { node_decl | external_endpoint | record_decl | enum_decl | link_decl | protocol_decl | hybrid_system_decl | delivery_policy_decl } '}'",
      "node_decl": "'node' IDENTIFIER '{' 'project' '=' STRING ';' 'role' '=' IDENTIFIER ';' '}'",
      "external_endpoint": "'external' IDENTIFIER '{' 'implementation' '=' 'external_rtl' ';' 'role' '=' IDENTIFIER ';' { property_decl } '}'",
      "record_decl": "'record' IDENTIFIER '{' { IDENTIFIER ':' type_ref ';' } '}'",
      "enum_decl": "'enum' IDENTIFIER ':' integer_type '{' enum_variant { ',' enum_variant } [ ',' ] '}'",
      "link_decl": "'link' IDENTIFIER '{' 'from' '=' reference ';' 'to' '=' reference ';' ('contract' '=' IDENTIFIER ';' | 'protocol' '=' IDENTIFIER ';') { property_decl } '}'",
      "protocol_decl": "'custom' 'protocol' IDENTIFIER protocol_body",
      "protocol_body": "'{' { property_decl | framing_block | header_block | sequence_block | payload_block | checksum_block | message_decl | receiver_block | behavior_block | protocol_state_machine } '}'",
      "framing_block": "'framing' property_block",
      "header_block": "'header' property_block",
      "sequence_block": "'sequence' property_block",
      "payload_block": "'payload' property_block",
      "checksum_block": "'checksum' property_block",
      "receiver_block": "'receiver' property_block",
      "behavior_block": "'behavior' property_block",
      "protocol_state_machine": "'state_machine' '{' { state_decl | protocol_transition } '}'",
      "state_decl": "'state' IDENTIFIER ';'",
      "protocol_transition": "'on' IDENTIFIER 'from' IDENTIFIER '->' IDENTIFIER ';'",
      "property_block": "'{' { property_decl } '}'",
      "message_decl": "'message' IDENTIFIER '{' ('id' '=' INTEGER ';' | field_decl | fragment_decl | property_decl)* '}'",
      "field_decl": "'field' IDENTIFIER ':' type_ref property_block",
      "fragment_decl": "'fragment' INTEGER '{' { field_decl | property_decl } '}'",
      "hybrid_system_decl": "'hybrid' 'system' IDENTIFIER '{' { property_decl | member_binding } '}'",
      "member_binding": "IDENTIFIER '=' expression ';'",
      "delivery_policy_decl": "'delivery_policy' IDENTIFIER property_block",
      "property_decl": "property_path '=' expression ';'",
      "reference": "IDENTIFIER { '.' IDENTIFIER }",
      "type_ref": "IDENTIFIER { '.' IDENTIFIER } ['[' INTEGER { ',' INTEGER } ']'] ['<' unit '>']",
      "expression": "or_expression",
      "enum_variant": "IDENTIFIER [ '=' INTEGER ]",
      "integer_type": "'u8' | 'u16' | 'u32' | 'u64' | 'i8' | 'i16' | 'i32' | 'i64'",
      "or_expression": "and_expression { 'or' and_expression }",
      "and_expression": "comparison_expression { 'and' comparison_expression }",
      "comparison_expression": "additive_expression [ comparison_operator additive_expression ]",
      "additive_expression": "multiplicative_expression { ('+' | '-') multiplicative_expression }",
      "multiplicative_expression": "unary_expression { ('*' | '/') unary_expression }",
      "unary_expression": "('+' | '-' | 'not') unary_expression | primary_expression",
      "primary_expression": "finite_literal | STRING | BOOLEAN | reference ['[' expression [':' expression] ']'] | vector_literal | matrix_literal | map_literal | select_expression | parenthesized_expression",
      "finite_literal": "FINITE_NUMBER [ unit ]",
      "vector_literal": "'[' [ expression { ',' expression } ] ']'",
      "matrix_literal": "'[' vector_literal { ',' vector_literal } ']'",
      "map_literal": "'map' '(' [ IDENTIFIER '=' expression { ',' IDENTIFIER '=' expression } ] ')'",
      "select_expression": "'select' '(' expression ',' expression ',' expression ')'",
      "parenthesized_expression": "'(' expression ')'",
      "comparison_operator": "'==' | '!=' | '<' | '<=' | '>' | '>='",
      "unit": "unit_atom { ('/' | '*') unit_atom }",
      "unit_atom": "'1' | IDENTIFIER [ '^' [ '+' | '-' ] INTEGER ]"
    }
  },
  "semantics": {
    "nodes_are_independent_builds": true,
    "remote_calls_are_forbidden": true,
    "link_contract_must_be_explicit": true,
    "struct_layout_is_not_wire_abi": true,
    "partial_build_must_be_reported": true,
    "external_rtl_is_never_generated_by_uef": true,
    "enum_values": "Enums have fixed-width integer storage. Omitted values increment from zero in source order; explicit values define stable wire or persistent ABI values. Values must fit and be unique.",
    "expression_resolution": "Expressions are data-only, finite, and side-effect-free. Names resolve to local declarations or imported .uefs contracts; and/or short-circuit with and binding more tightly than or. No user code executes.",
    "expression_operators": "The .uefs precedence is one bounded index or half-open slice, unary + - not, left-associative * /, left-associative + -, one non-chainable comparison, and, then or. and/or short-circuit left to right. There is no power, cast, function-call, or arbitrary invocation syntax in .uefs. map constructs a statically expected record; select requires a boolean condition and identical branch type/unit/shape.",
    "type_checking": "Resolve scalar and unit semantics through the shared UETD project-language core type contract; resolve records/enums through the local system or imported node contracts. References must resolve to declared local values, imported contract fields, or exact node endpoints permitted by the enclosing link. No implicit numeric, enum, unit, shape, or record conversion; no dynamic dimension, pointer, null, or runtime allocation. Every system expression is checked against its property or endpoint contract.",
    "contract_import": "A contract import resolves one normalized relative path beneath the declared system source root. It imports only named records, enums, protocol contracts, and endpoint facts; it cannot execute code, traverse outside the project root, or recursively compile sibling node projects.",
    "protocol_mapping": "Each message field maps to one logical record field unless marked protocol_internal; raw_payload=true is required for opaque messages. Message-field offsets are relative to that message payload, fragment offsets are relative to their fragment payload, and header/sequence offsets are absolute frame offsets. Offsets and widths are byte/bit precise, nonoverlapping, and in bounds; gaps require explicit reserved fields. Scaling means decoded_value=wire_integer*scale+offset and its inverse uses declared rounding and overflow. Signed encoding, byte/bit order, reserved bits, version, sequence, checksum range/placement, freshness, and incomplete-frame behavior are explicit; generated struct layout is never wire ABI.",
    "hybrid_system": "Bindings name local nodes, external endpoints, and links only. They do not define callable remote functions. Every endpoint direction and message must have a declared link owner, protocol, delivery/recovery policy, and local receiving contract. External FPGA implementation code is outside UETD generation.",
    "multi_target_generation": "Each node is independently type-checked and built for its exact target. Cross-node type compatibility is checked against the system contract. Partial build results identify the completed and failed nodes and do not imply a complete deployable system."
  }
}
